### ISSUE TITLE
Traffic is not working 

### ISSUE THREAD

**Issue by shivanranj** [pa5h1nh0/GTP-U_OvS-kernel-extension#4]
@pa5h1nh0 :   I am facing below issues with traffic(UL/DL)

UL traffic from SGW:
I can see  GTP packet are landing on physical NIC from SGW(S5 interface), but i don't see any action in the kernel. Ideally i should see UE packet in SGI bridge,I don't see UE packet in SGI bridge.   

DL traffic from SGI:
I can see that UE packets are landing at SGI bridge and kernel is adding GTP header with proper MAC address and forwarding to S5 bridge, but i don't see that going out physical NIC.

Did you face any issue like that while testing traffic?  if you have any input please share 

Regards,
Ranjith

**Comment by pa5h1nh0** [comment]
This is a misconfiguration issue, has nothing to do with this OvS extension. Describe as best as you can, with a drawing, your test environment. Like the pic here https://ibb.co/mu7Sok .
Otherwise it's impossible to understand what's wrong.

**Comment by shivanranj** [comment]
@pa5h1nh0 : The below are configuration details:

root@mysite-vpgwu-slice1-12:/home/ubuntu/openvswitch-2.5.0/utilities# ovs-vsctl show
e45e1ce3-ce99-451b-ac5d-99016c9a65b0
    Bridge SGi
        Port "eth0"
            Interface "eth0"
        Port SGi
            Interface SGi
                type: internal
    Bridge "S5"
        Port "eth2"
            Interface "eth2"
        Port "S5"
            Interface "S5"
                type: internal

root@mysite-vpgwu-slice1-12:/home/ubuntu/openvswitch-2.5.0/utilities# ovs-ofctl dump-ports SGi
OFPST_PORT reply (xid=0x2): 2 ports
  port LOCAL: rx pkts=15442, bytes=6846342, drop=0, errs=0, frame=0, over=0, crc=0
           tx pkts=14084, bytes=3655273, drop=0, errs=0, coll=0
  port  2: rx pkts=58809, bytes=84963365, drop=0, errs=0, frame=0, over=0, crc=0
           tx pkts=49924, bytes=6958946, drop=0, errs=0, coll=0

root@mysite-vpgwu-slice1-12:/home/ubuntu/openvswitch-2.5.0/utilities# ovs-ofctl dump-ports S5
OFPST_PORT reply (xid=0x2): 2 ports
  port LOCAL: rx pkts=14650, bytes=1280455, drop=0, errs=0, frame=0, over=0, crc=0
           tx pkts=9308, bytes=839046, drop=0, errs=0, coll=0
  port  2: rx pkts=78453, bytes=15269507, drop=0, errs=0, frame=0, over=0, crc=0
           tx pkts=17560, bytes=3309200, drop=0, errs=0, coll=0
root@mysite-vpgwu-slice1-12:/home/ubuntu/openvswitch-2.5.0/utilities#

Added Flows :

./ovs-dpctl add-gtpu-flow "ipv4(dst=172.24.1.4,frag=no)" "push_gtp(src=172.19.1.10,dst=172.27.170.240,teid=010008), 2"

./ovs-dpctl add-gtpu-flow "gtp(teid=65,dst=172.19.1.10)" "pop_gtp,2"

Flows:
root@mysite-vpgwu-slice1-12:/home/ubuntu/openvswitch-2.5.0/utilities# ./ovs-dpctl dump-flows
ipv4(dst=172.24.1.4,frag=no), packets:2281, bytes:223538, used:0.224s, actions:push_gtp(src=172.19.1.10,dst=172.27.170.240,teid=10008),2
gtp(teid=65,dst=172.19.1.10), packets:0, bytes:0, used:never, actions:pop_gtp,2

OVS bridge Details:
root@mysite-vpgwu-slice1-12:/home/ubuntu/openvswitch-2.5.0/utilities# ifconfig SGI
SGI: error fetching interface information: Device not found
root@mysite-vpgwu-slice1-12:/home/ubuntu/openvswitch-2.5.0/utilities# ifconfig SGi
SGi       Link encap:Ethernet  HWaddr fa:16:3e:82:57:47
          inet addr:172.20.1.2  Bcast:172.20.1.255  Mask:255.255.255.0
          inet6 addr: fe80::501d:38ff:fe05:940/64 Scope:Link
          UP BROADCAST RUNNING MULTICAST  MTU:1500  Metric:1
          RX packets:15462 errors:0 dropped:0 overruns:0 frame:0
          TX packets:14104 errors:0 dropped:0 overruns:0 carrier:0
          collisions:0 txqueuelen:0
          RX bytes:6851702 (6.8 MB)  TX bytes:3660913 (3.6 MB)

root@mysite-vpgwu-slice1-12:/home/ubuntu/openvswitch-2.5.0/utilities# ifconfig S5
S5        Link encap:Ethernet  HWaddr fa:16:3e:f8:ee:d4
          inet addr:172.19.1.10  Bcast:172.19.1.255  Mask:255.255.255.0
          inet6 addr: fe80::6cdc:57ff:fec7:b048/64 Scope:Link
          UP BROADCAST RUNNING MULTICAST  MTU:1500  Metric:1
          RX packets:14802 errors:0 dropped:0 overruns:0 frame:0
          TX packets:9308 errors:0 dropped:0 overruns:0 carrier:0
          collisions:0 txqueuelen:0
          RX bytes:1298695 (1.2 MB)  TX bytes:839046 (839.0 KB)

am i missed anything in configuration?

Regards,
Ranjith

**Comment by shivanranj** [comment]
@pa5h1nh0 
1)172.24.1.4 UE IP 
2)172.27.170.24 - SGW IP
3)172.19.1.10  - S5 Interface IP
4)172.20.1.2 - SGI interface IP

**Comment by shivanranj** [comment]
@pa5h1nh0 :    

The below Tcpdump at eth0(SGI port):

root@mysite-vpgwu-slice1-12:/home/ubuntu/openvswitch-2.5.0/utilities# tcpdump -i eth0 icmp
tcpdump: WARNING: eth0: no IPv4 address assigned
tcpdump: verbose output suppressed, use -v or -vv for full protocol decode
listening on eth0, link-type EN10MB (Ethernet), capture size 65535 bytes
20:24:17.273255 IP 192.168.10.254 > 172.24.1.4: ICMP echo request, id 5935, seq 1560, length 64
20:24:18.273281 IP 192.168.10.254 > 172.24.1.4: ICMP echo request, id 5935, seq 1561, length 64
20:24:19.273268 IP 192.168.10.254 > 172.24.1.4: ICMP echo request, id 5935, seq 1562, length 64
20:24:20.273279 IP 192.168.10.254 > 172.24.1.4: ICMP echo request, id 5935, seq 1563, length 64
20:24:21.273298 IP 192.168.10.254 > 172.24.1.4: ICMP echo request, id 5935, seq 1564, length 64
20:24:22.273237 IP 192.168.10.254 > 172.24.1.4: ICMP echo request, id 5935, seq 1565, length 64
20:24:23.273264 IP 192.168.10.254 > 172.24.1.4: ICMP echo request, id 5935, seq 1566, length 64
20:24:24.273276 IP 192.168.10.254 > 172.24.1.4: ICMP echo request, id 5935, seq 1567, length 64
20:24:25.273280 IP 192.168.10.254 > 172.24.1.4: ICMP echo request, id 5935, seq 1568, length 64
20:24:26.273233 IP 192.168.10.254 > 172.24.1.4: ICMP echo request, id 5935, seq 1569, length 64

At S5 Bridge:

root@mysite-vpgwu-slice1-12:/home/ubuntu/openvswitch-2.5.0/utilities# tcpdump -i S5 udp
tcpdump: verbose output suppressed, use -v or -vv for full protocol decode
listening on S5, link-type EN10MB (Ethernet), capture size 65535 bytes
20:26:02.273520 IP 172.19.1.10.2152 > 172.27.170.240.2152: UDP, length 92
20:26:03.273548 IP 172.19.1.10.2152 > 172.27.170.240.2152: UDP, length 92
20:26:04.273531 IP 172.19.1.10.2152 > 172.27.170.240.2152: UDP, length 92
20:26:05.273538 IP 172.19.1.10.2152 > 172.27.170.240.2152: UDP, length 92
20:26:06.273506 IP 172.19.1.10.2152 > 172.27.170.240.2152: UDP, length 92
20:26:07.273558 IP 172.19.1.10.2152 > 172.27.170.240.2152: UDP, length 92
20:26:08.273510 IP 172.19.1.10.2152 > 172.27.170.240.2152: UDP, length 92
20:26:09.273532 IP 172.19.1.10.2152 > 172.27.170.240.2152: UDP, length 92

But the above UDP GTP packet are not coming out on Eth2 NIC( S5 port)

Regards,
Ranjith

**Comment by shivanranj** [comment]
@pa5h1nh0 

I can reach SG from S5 interface bridge:

root@mysite-vpgwu-slice1-12:/home/ubuntu/openvswitch-2.5.0/utilities# ping 172.27.170.240 -I S5
PING 172.27.170.240 (172.27.170.240) from 172.19.1.10 S5: 56(84) bytes of data.
64 bytes from 172.27.170.240: icmp_seq=1 ttl=61 time=1.35 ms
64 bytes from 172.27.170.240: icmp_seq=2 ttl=61 time=0.994 ms
64 bytes from 172.27.170.240: icmp_seq=3 ttl=61 time=0.875 ms
64 bytes from 172.27.170.240: icmp_seq=4 ttl=61 time=0.862 ms
64 bytes from 172.27.170.240: icmp_seq=5 ttl=61 time=0.792 ms
64 bytes from 172.27.170.240: icmp_seq=6 ttl=61 time=0.910 ms
64 bytes from 172.27.170.240: icmp_seq=7 ttl=61 time=0.874 ms
64 bytes from 172.27.170.240: icmp_seq=8 ttl=61 time=0.938 ms
64 bytes from 172.27.170.240: icmp_seq=9 ttl=61 time=1.45 ms

**Comment by pa5h1nh0** [comment]
The fact that I clearly stated that this is an OvS kernel module extension, and then you posting the output of the `ovs-ofctl` and `ovs-vsctl` commands, proves me that you don't know what you're doing. You already made me waste a lot of time, also you can't expect me to be available at any time answering all of your questions (I do also have a job). Read carefully and understand the following: https://stackoverflow.com/questions/31888639/the-difference-between-ovs-vsctl-and-ovs-dpctl http://therandomsecurityguy.com/openvswitch-cheat-sheet/ . Once you do this, try to troubleshoot and answer your own problems, because this is not a problem with my OvS extension (you simply don't know how to properly use it). I'm not here to teach you how to use Open vSwitch, you should already have a pretty thorough knowledge of OvS prior to work with such type of OvS extensions. When you get at the point of having a really really good usage skills with OvS, you should be able to answer all of your questions all by yourself, you will also understand when there's any strange behavior with the OvS itself, including extensions. I won't answer to any of your illegitimate questions until I see that you really know what you're doing and saying.

**Comment by shivanranj** [comment]
@pa5h1nh0  : Thank you, I was using user space port number by using ovs-vsctl dump-port command which is wrong. I used port numbers from by using ovs-dpctl dumport and working fine. The only issue is UDP check. i have added code for calculating UDP checksum also. Now the DL packet is reaching eNodeB successfully and UL packet from Mobile is reaching to internet.

**Comment by pa5h1nh0** [comment]
@shivanranj Nice to hear that. Good job also for adding UDP checksum computation ;)
